{
  "identity": {
    "agentName": "stock_sim_consumer",
    "displayName": "stock-sim-consumer",
    "description": "Consumer agent that submits a pipe task to stock-sim and consumes the resulting stock-price stream.",
    "version": "1.0.0",
    "provider": {
      "organization": "PubNub"
    }
  },
  "capabilities": {
    "taskKinds": [
      "request"
    ]
  },
  "io": {
    "inputs": [
      {
        "id": "config",
        "description": "Optional stock request parameters. If omitted and the process is interactive, the handler will prompt before sending the task.",
        "contentType": "application/json",
        "required": false,
        "example": {
          "symbols": "AAPL,MSFT,NVDA",
          "durationMinutes": 1
        },
        "schema": {
          "type": "object",
          "properties": {
            "symbols": {
              "type": "string",
              "title": "Stock Symbols",
              "description": "Comma-separated symbols to request from stock-sim.",
              "default": "AAPL,MSFT,NVDA"
            },
            "durationMinutes": {
              "type": "number",
              "title": "Duration (minutes)",
              "description": "How long the provider should stream prices.",
              "default": 1
            }
          }
        }
      }
    ],
    "outputs": [
      {
        "id": "summary",
        "description": "Summary of the streamed stock quotes.",
        "contentType": "application/json",
        "guaranteed": true
      }
    ]
  },
  "tags": [
    {
      "id": "consume-stock-stream",
      "name": "Consume Stock Stream",
      "description": "Submits a pipe task to stock-sim and returns a summary of the streamed quotes."
    }
  ],
  "runtime": {
    "handler": "./handler.ts",
    "handlerExport": "default",
    "concurrency": 1,
    "expectedInstances": 1,
    "maxPendingBacklog": 10,
    "maxRunningTimeSec": 3600
  }
}
